{
  "environment_spec_id": "eng_mdo_uv",
  "schema_version": "1.0.0",
  "runtime_profile": "eng-mdo",
  "delivery_kind": "uv_venv",
  "module_ids": ["casadi", "pymoo", "openmdao"],
  "supported_host_platforms": ["darwin-arm64", "linux-amd64"],
  "manifest_format": "requirements_txt",
  "manifest_path": "knowledge/coding-tools/runtime/uv/eng-mdo.requirements.txt",
  "runtime_locator": ".cache/knowledge-envs/eng-mdo",
  "bootstrap_command": "python scripts/bootstrap_knowledge_runtime.py --environment-ref artifact://environment-spec/eng_mdo_uv",
  "healthcheck_command": "python scripts/verify_knowledge_runtime.py --environment-ref artifact://environment-spec/eng_mdo_uv",
  "launcher_ref": "knowledge/coding-tools/runtime/launchers/eng-mdo.sh",
  "notes": ["Companion local runtime for Python-first MDO libraries."]
}
